{
    "attachment": [
        {
            "filename": "part-000",
            "size": 2719,
            "hash": {
                "md5": "b97c6b1496aebddf38879646b4ddbe58",
                "sha1": "0d27fb974c6a0bca756a9337b632dcaaf2b2420a",
                "sha256": "dccb8cb006e3ea215090af267b9d5e03f76fed33dabb8c40c67a7b440dbe134c",
                "sha512": "a5ee42748b228234e4ec4862dc8f05e4a13f2f6dd91e4994a7e54e81a9983fded6e70f58a3d537050f48450a57e964e7481c8952d04dc4c9a7d1606da93a91f5"
            },
            "content_header": {
                "content-type": [
                    "message/rfc822"
                ]
            }
        }
    ],
    "body": [
        {
            "email": [
                "shkrueger@cuny.edu",
                "mtp.mailfrom=zack@asdfghjkl.ovh",
                "73516fbb-2d72-4c88-855b-91c5850d2b2e@desktop-9avsair",
                "zack@asdfghjkl.ovh"
            ],
            "domain": [
                "cuny.edu",
                "excpm5703.enterpriseapps.cuny.adlan",
                "172.29.210.63",
                "ppsm1.cuny.edu",
                "host-185-25-217-220.jmdi.pl",
                "ppa1.cuny.edu",
                "asdfghjkl.ovh"
            ],
            "ip": [
                "185.25.217.220",
                "8.16.0.43"
            ],
            "content_header": {
                "content-type": [
                    "text/plain; charset=\"us-ascii\""
                ],
                "content-transfer-encoding": [
                    "quoted-printable"
                ]
            },
            "content": "Delivery has failed to these recipients or groups:\r\n\r\nshkrueger@cuny.edu<mailto:shkrueger@cuny.edu>\r\nThe email address you entered couldn't be found. Please check the recipient's email address and try to resend the message. If the problem continues, please contact your helpdesk.\r\n\r\n\r\n\r\n\r\n\r\n\r\n\r\n\r\nDiagnostic information for administrators:\r\n\r\nGenerating server: EXCPM5703.enterpriseapps.cuny.adlan\r\n\r\nshkrueger@cuny.edu\r\nRemote Server returned '550 5.1.1 RESOLVER.ADR.RecipNotFound; not found'\r\n\r\nOriginal message headers:\r\n\r\nReceived: from EXCPM5703.enterpriseapps.cuny.adlan (172.29.210.63) by\r\n EXCPM5703.enterpriseapps.cuny.adlan (172.29.210.63) with Microsoft SMTP\r\n Server (TLS) id 15.0.1497.18; Sun, 29 Aug 2021 19:46:31 -0400\r\nReceived: from ppsm1.cuny.edu (172.28.0.167) by\r\n EXCPM5703.enterpriseapps.cuny.adlan (172.29.210.63) with Microsoft SMTP\r\n Server (TLS) id 15.0.1497.18 via Frontend Transport; Sun, 29 Aug 2021\r\n 19:46:31 -0400\r\nAuthentication-Results: cuny.edu;\r\n        spf=none smtp.mailfrom=zack@asdfghjkl.ovh;\r\n        dmarc=none\r\nReceived: from DESKTOP-9AVSAIR (host-185-25-217-220.jmdi.pl [185.25.217.220])\r\n        by ppa1.cuny.edu (8.16.0.43/8.16.0.43) with ESMTPS id 17TNkTPl011297\r\n        (version=TLSv1.2 cipher=ECDHE-RSA-AES128-GCM-SHA256 bits=128 verify=NOT)\r\n        for <shkrueger@cuny.edu>; Sun, 29 Aug 2021 19:46:30 -0400\r\nContent-Type: text/plain; charset=\"utf-8\"\r\nMIME-Version: 1.0\r\nMessage-ID: <73516FBB-2D72-4C88-855B-91C5850D2B2E@DESKTOP-9AVSAIR>\r\nDate: Mon, 30 Aug 2021 01:45:34 +0200\r\nFrom: <zack@asdfghjkl.ovh>\r\nTo: <shkrueger@cuny.edu>\r\nSubject: Hello, how can i help with this?\r\nContent-Transfer-Encoding: quoted-printable\r\nAuto-Submitted: auto-replied\r\nX-hMailServer-LoopCount: 1\r\nX-Proofpoint-ORIG-GUID: wJbgZX9Qd9A4LEd6397cbYhLS53TpXyr\r\nX-CLX-Response: 1TFkXBxseHBEKWUQXax9tHG9femNiH0cRClhYF2xscB9YRnxoZQF4EQp4Thd\r\n uHRIdQVtMHk8ZWREKeUwXYGJJH0hYXWd6U0QRCkNIFwceEQpDWRcHGB0aEQpDSRcaBBoaGhEKWU\r\n 0XZ2ZyEQpZSRcHGBpxGwYHGRN3BgcSHQYaBhoGGgYHGRpxGhAbdwYaBhoGGgYHGxoGGgYacRoQG\r\n ncGGhEKWV4XaGN5EQpJRhdJX0RTdVpYRU5fSV5DRUQZXEcRCkNOF11gSE1wchN7ThNrHmZvThwZ\r\n Ex1JSHNCZnkfGX5aclNYEQpYXBcfBBoEGBkZBRsaBBsbGgQfGgQbHhgQGx4aHxoRCl5ZF3NzSW5\r\n TEQpNXBcbEQpMWhdSbkNraxEKRVkXTWsRCkxfF3oFBQUFBQUFBQUYEQpNThdvEQpMRhdja2trEQ\r\n pCTxdoZ2BLZXpDWBtSHBEKQ1oXGxIfBBgfBBgbHQQYGBoRCkJFF2xscB9YRnxoZQF4EQpCThduH\r\n RIdQVtMHk8ZWREKQkwXbGxwH1hGfGhlAXgRCkJsF2xscB9YRnxoZQF4EQpCQBdnRWdTRUl8f1pv\r\n GxEKQlgXaB5Af25yH35Db24RCk1eFwcbEQp5QxdofWxofFxrRl14ZxEKcGgXYQV6Rl9/Rk1uRxo\r\n QBxkaEQptfhcHGxEKWE0XSxEg\r\nX-CLX-Shades: MLX\r\nX-Proofpoint-GUID: wJbgZX9Qd9A4LEd6397cbYhLS53TpXyr\r\nX-Proofpoint-Virus-Version: vendor=fsecure engine=2.50.10434:6.0.391,18.0.790\r\n definitions=2021-08-29_09:2021-08-27,2021-08-29 signatures=0\r\nX-Proofpoint-Spam-Details: rule=inbound_notspam policy=inbound score=47 mlxscore=47 clxscore=-146\r\n mlxlogscore=5 adultscore=0 spamscore=47 phishscore=0 impostorscore=0\r\n priorityscore=1501 lowpriorityscore=0 malwarescore=0 bulkscore=0\r\n suspectscore=0 classifier=spam adjust=0 reason=mlx scancount=1\r\n engine=8.12.0-2107140000 definitions=main-2108290155\r\nReturn-Path: zack@asdfghjkl.ovh\r\n\r\n",
            "content_type": "text/plain",
            "hash": "9dc4d56348a94f66607396c36994afe37ddad93641c2bd0635ff25e88a2f13c9",
            "boundary": "0d018599-2c7e-463e-96bd-799720986f4e"
        },
        {
            "content_header": {
                "reporting-mta": [
                    "dns;EXCPM5703.enterpriseapps.cuny.adlan"
                ],
                "received-from-mta": [
                    "dns;ppsm1.cuny.edu"
                ],
                "arrival-date": [
                    "Sun, 29 Aug 2021 23:46:31 +0000"
                ]
            },
            "content": "",
            "hash": "e3b0c44298fc1c149afbf4c8996fb92427ae41e4649b934ca495991b7852b855"
        },
        {
            "content_header": {
                "final-recipient": [
                    "rfc822;shkrueger@cuny.edu"
                ],
                "action": [
                    "failed"
                ],
                "status": [
                    "5.1.1"
                ],
                "diagnostic-code": [
                    "smtp;550 5.1.1 RESOLVER.ADR.RecipNotFound; not found"
                ]
            },
            "content": "",
            "hash": "e3b0c44298fc1c149afbf4c8996fb92427ae41e4649b934ca495991b7852b855"
        },
        {
            "content_header": {},
            "content": "",
            "hash": "e3b0c44298fc1c149afbf4c8996fb92427ae41e4649b934ca495991b7852b855"
        },
        {
            "content_header": {
                "received": [
                    "from EXCPM5703.enterpriseapps.cuny.adlan (172.29.210.63) by EXCPM5703.enterpriseapps.cuny.adlan (172.29.210.63) with Microsoft SMTP Server (TLS) id 15.0.1497.18; Sun, 29 Aug 2021 19:46:31 -0400",
                    "from ppsm1.cuny.edu (172.28.0.167) by EXCPM5703.enterpriseapps.cuny.adlan (172.29.210.63) with Microsoft SMTP Server (TLS) id 15.0.1497.18 via Frontend Transport; Sun, 29 Aug 2021 19:46:31 -0400",
                    "from DESKTOP-9AVSAIR (host-185-25-217-220.jmdi.pl [185.25.217.220])\tby ppa1.cuny.edu (8.16.0.43/8.16.0.43) with ESMTPS id 17TNkTPl011297\t(version=TLSv1.2 cipher=ECDHE-RSA-AES128-GCM-SHA256 bits=128 verify=NOT)\tfor <shkrueger@cuny.edu>; Sun, 29 Aug 2021 19:46:30 -0400"
                ],
                "authentication-results": [
                    "cuny.edu;\tspf=none smtp.mailfrom=zack@asdfghjkl.ovh;\tdmarc=none"
                ],
                "content-type": [
                    "text/plain; charset=\"utf-8\""
                ],
                "mime-version": [
                    "1.0"
                ],
                "message-id": [
                    "<73516FBB-2D72-4C88-855B-91C5850D2B2E@DESKTOP-9AVSAIR>"
                ],
                "date": [
                    "Mon, 30 Aug 2021 01:45:34 +0200"
                ],
                "from": [
                    "zack@asdfghjkl.ovh"
                ],
                "to": [
                    "shkrueger@cuny.edu"
                ],
                "subject": [
                    "Hello, how can i help with this?"
                ],
                "content-transfer-encoding": [
                    "quoted-printable"
                ],
                "auto-submitted": [
                    "auto-replied"
                ],
                "x-hmailserver-loopcount": [
                    "1"
                ],
                "x-proofpoint-orig-guid": [
                    "wJbgZX9Qd9A4LEd6397cbYhLS53TpXyr"
                ],
                "x-clx-response": [
                    "1TFkXBxseHBEKWUQXax9tHG9femNiH0cRClhYF2xscB9YRnxoZQF4EQp4Thd uHRIdQVtMHk8ZWREKeUwXYGJJH0hYXWd6U0QRCkNIFwceEQpDWRcHGB0aEQpDSRcaBBoaGhEKWU 0XZ2ZyEQpZSRcHGBpxGwYHGRN3BgcSHQYaBhoGGgYHGRpxGhAbdwYaBhoGGgYHGxoGGgYacRoQG ncGGhEKWV4XaGN5EQpJRhdJX0RTdVpYRU5fSV5DRUQZXEcRCkNOF11gSE1wchN7ThNrHmZvThwZ Ex1JSHNCZnkfGX5aclNYEQpYXBcfBBoEGBkZBRsaBBsbGgQfGgQbHhgQGx4aHxoRCl5ZF3NzSW5 TEQpNXBcbEQpMWhdSbkNraxEKRVkXTWsRCkxfF3oFBQUFBQUFBQUYEQpNThdvEQpMRhdja2trEQ pCTxdoZ2BLZXpDWBtSHBEKQ1oXGxIfBBgfBBgbHQQYGBoRCkJFF2xscB9YRnxoZQF4EQpCThduH RIdQVtMHk8ZWREKQkwXbGxwH1hGfGhlAXgRCkJsF2xscB9YRnxoZQF4EQpCQBdnRWdTRUl8f1pv GxEKQlgXaB5Af25yH35Db24RCk1eFwcbEQp5QxdofWxofFxrRl14ZxEKcGgXYQV6Rl9/Rk1uRxo QBxkaEQptfhcHGxEKWE0XSxEg"
                ],
                "x-clx-shades": [
                    "MLX"
                ],
                "x-proofpoint-guid": [
                    "wJbgZX9Qd9A4LEd6397cbYhLS53TpXyr"
                ],
                "x-proofpoint-virus-version": [
                    "vendor=fsecure engine=2.50.10434:6.0.391,18.0.790 definitions=2021-08-29_09:2021-08-27,2021-08-29 signatures=0"
                ],
                "x-proofpoint-spam-details": [
                    "rule=inbound_notspam policy=inbound score=47 mlxscore=47 clxscore=-146 mlxlogscore=5 adultscore=0 spamscore=47 phishscore=0 impostorscore=0 priorityscore=1501 lowpriorityscore=0 malwarescore=0 bulkscore=0 suspectscore=0 classifier=spam adjust=0 reason=mlx scancount=1 engine=8.12.0-2107140000 definitions=main-2108290155"
                ],
                "return-path": [
                    "zack@asdfghjkl.ovh"
                ]
            },
            "content": "***ATTENTION: This email came from an external source. Do not open attachments or click on links from unknown senders or unexpected emails.*** \r\n\r\nHello,\r\nhow can I help you with this?\r\n\r\nSincerely\r\nZack\r\n\r\n",
            "content_type": "text/plain",
            "hash": "673eecbe484a82b5b61fdea862fe91209945ac412e3aaef5f0ef87b843823800"
        }
    ],
    "header": {
        "subject": "Undeliverable: Hello, how can i help with this?",
        "from": "postmaster@mail.cuny.edu",
        "to": [
            "zack@asdfghjkl.ovh"
        ],
        "date": "2021-08-29T19:46:31-04:00",
        "received_domain": [
            "excpm5703.enterpriseapps.cuny.adlan",
            "ppa1.cuny.edu",
            "ppsm1.cuny.edu"
        ],
        "received_ip": [
            "8.16.0.43",
            "128.228.0.167"
        ],
        "received_foremail": [
            "zack@asdfghjkl.ovh"
        ],
        "bait_method": "Other guestbooks",
        "language": "English"
    }
}