{
    "attachment": [
        {
            "filename": "part-000",
            "size": 2711,
            "hash": {
                "md5": "ec4aa6644a5d7c26106150e05452eacf",
                "sha1": "0350e08696d04eacef5d524f3a0804b105759113",
                "sha256": "c446daf503500fee24bea250fe9e5a0eb6beea9608f7469524e94b11512bd98e",
                "sha512": "6745e62e5d4246e1dc5d7cf6cce59679a473d00e29e689e8f97ebad912699e014a53b183a5840322a801e58050b1dcccde9f164d8fd640665a575baa372013a1"
            },
            "content_header": {
                "content-type": [
                    "message/rfc822"
                ]
            }
        }
    ],
    "body": [
        {
            "email": [
                "shkrueger@cuny.edu",
                "p.mailfrom=oswald@asdfghjkl.ovh",
                "59664731-3596-4869-b4a7-c42b2ec4b31a@desktop-9avsair",
                "oswald@asdfghjkl.ovh"
            ],
            "domain": [
                "cuny.edu",
                "excpm5702.enterpriseapps.cuny.adlan",
                "excpm5701.enterpriseapps.cuny.adlan",
                "172.29.210.61",
                "172.29.210.62",
                "ppsm1.cuny.edu",
                "host-185-25-217-220.jmdi.pl",
                "ppa1.cuny.edu",
                "asdfghjkl.ovh"
            ],
            "ip": [
                "185.25.217.220",
                "8.16.0.43"
            ],
            "content_header": {
                "content-type": [
                    "text/plain; charset=\"us-ascii\""
                ],
                "content-transfer-encoding": [
                    "quoted-printable"
                ]
            },
            "content": "Delivery has failed to these recipients or groups:\r\n\r\nshkrueger@cuny.edu<mailto:shkrueger@cuny.edu>\r\nThe email address you entered couldn't be found. Please check the recipient's email address and try to resend the message. If the problem continues, please contact your helpdesk.\r\n\r\n\r\n\r\n\r\n\r\n\r\n\r\n\r\nDiagnostic information for administrators:\r\n\r\nGenerating server: EXCPM5702.enterpriseapps.cuny.adlan\r\n\r\nshkrueger@cuny.edu\r\nRemote Server returned '550 5.1.1 RESOLVER.ADR.RecipNotFound; not found'\r\n\r\nOriginal message headers:\r\n\r\nReceived: from EXCPM5701.enterpriseapps.cuny.adlan (172.29.210.61) by\r\n EXCPM5702.enterpriseapps.cuny.adlan (172.29.210.62) with Microsoft SMTP\r\n Server (TLS) id 15.0.1497.2; Wed, 25 Aug 2021 08:33:37 -0400\r\nReceived: from ppsm1.cuny.edu (172.28.0.167) by\r\n EXCPM5701.enterpriseapps.cuny.adlan (172.29.210.61) with Microsoft SMTP\r\n Server (TLS) id 15.0.1497.2 via Frontend Transport; Wed, 25 Aug 2021 08:33:37\r\n -0400\r\nAuthentication-Results: cuny.edu;\r\n        spf=none smtp.mailfrom=oswald@asdfghjkl.ovh;\r\n        dmarc=none\r\nReceived: from DESKTOP-9AVSAIR (host-185-25-217-220.jmdi.pl [185.25.217.220])\r\n        by ppa1.cuny.edu (8.16.0.43/8.16.0.43) with ESMTPS id 17PCXZve013346\r\n        (version=TLSv1.2 cipher=ECDHE-RSA-AES128-GCM-SHA256 bits=128 verify=NOT)\r\n        for <shkrueger@cuny.edu>; Wed, 25 Aug 2021 08:33:36 -0400\r\nContent-Type: text/plain; charset=\"utf-8\"\r\nMIME-Version: 1.0\r\nMessage-ID: <59664731-3596-4869-B4A7-C42B2EC4B31A@DESKTOP-9AVSAIR>\r\nDate: Wed, 25 Aug 2021 14:32:53 +0200\r\nFrom: <oswald@asdfghjkl.ovh>\r\nTo: <shkrueger@cuny.edu>\r\nSubject: Hello, how can i help?\r\nContent-Transfer-Encoding: quoted-printable\r\nAuto-Submitted: auto-replied\r\nX-hMailServer-LoopCount: 1\r\nX-CLX-Response: 1TFkXBxMdEQpZRBdrfHp7Rx5mZEdOThEKWFgXZH5OZxxfcm4BZ2cRCnhOF24\r\n dEh1BW0weTxlZEQp5TBd6ElNuRFtJS3xeBREKQ0gXBx4RCkNZFwcYHh8RCkNJFxoEGhoaEQpZTR\r\n dnZnIRCllJFwcbGXEbBgcYH3cGBx0SBhoGGgYZBhpxGhAadwYaBhoGGgYHGxoGGgYacRoQGncGG\r\n hEKWV4XaGN5EQpJRhdJX0RTdVpYRU5fSV5DRUQZXEcRCkNOF1MHSVliQXtuQHJQU1gbS2NlRRNO\r\n Z2RvH2QaHVB5ZkRZEQpYXBcfBBoEGBkZBRsaBBsbGgQfGgQbHhgQGx4aHxoRCl5ZF3N9ExoSEQp\r\n NXBccEQpMWhdSaUNraxEKRVkXTWsRCkxfF3oFBQUFBQUFBQUYEQpNThdvEQpMRhdja2trEQpCTx\r\n doZ2BLZXpDWBtSHBEKQ1oXGxIfBBgfBBgbHQQYGBoRCkJFF2R+TmccX3JuAWdnEQpCThduHRIdQ\r\n VtMHk8ZWREKQkwXZH5OZxxfcm4BZ2cRCkJsF2R+TmccX3JuAWdnEQpCQBdoWU1tSWJpaGEBbhEK\r\n QlgXaB5Af25yH35Db24RCk1eFwcbEQp5QxdpEmVSH2J+Rn8SehEKcGgXbBNlGnljEksSRRwQBxk\r\n aEQptfhcHGxEKWE0XSxEg\r\nX-Proofpoint-ORIG-GUID: y-csHkQDjXzyr1aIOo9dMNE5N07zSLns\r\nX-CLX-Shades: MLX\r\nX-Proofpoint-GUID: y-csHkQDjXzyr1aIOo9dMNE5N07zSLns\r\nX-Proofpoint-Virus-Version: vendor=fsecure engine=2.50.10434:6.0.391,18.0.790\r\n definitions=2021-08-25_05:2021-08-25,2021-08-25 signatures=0\r\nX-Proofpoint-Spam-Details: rule=inbound_notspam policy=inbound score=42 lowpriorityscore=0\r\n clxscore=-97 priorityscore=1501 bulkscore=0 impostorscore=0 malwarescore=0\r\n mlxscore=42 spamscore=42 mlxlogscore=15 adultscore=0 suspectscore=0\r\n phishscore=0 classifier=spam adjust=0 reason=mlx scancount=1\r\n engine=8.12.0-2107140000 definitions=main-2108250075\r\nReturn-Path: oswald@asdfghjkl.ovh\r\n\r\n",
            "content_type": "text/plain",
            "hash": "4c16d88ae78e84df52a9b55c3b765d97ebf969d510f67969f6459950b5df5734",
            "boundary": "a83b66f1-73df-4880-b8fe-67c44e78a58f"
        },
        {
            "content_header": {
                "reporting-mta": [
                    "dns;EXCPM5702.enterpriseapps.cuny.adlan"
                ],
                "received-from-mta": [
                    "dns;ppsm1.cuny.edu"
                ],
                "arrival-date": [
                    "Wed, 25 Aug 2021 12:33:37 +0000"
                ]
            },
            "content": "",
            "hash": "e3b0c44298fc1c149afbf4c8996fb92427ae41e4649b934ca495991b7852b855"
        },
        {
            "content_header": {
                "final-recipient": [
                    "rfc822;shkrueger@cuny.edu"
                ],
                "action": [
                    "failed"
                ],
                "status": [
                    "5.1.1"
                ],
                "diagnostic-code": [
                    "smtp;550 5.1.1 RESOLVER.ADR.RecipNotFound; not found"
                ]
            },
            "content": "",
            "hash": "e3b0c44298fc1c149afbf4c8996fb92427ae41e4649b934ca495991b7852b855"
        },
        {
            "content_header": {},
            "content": "",
            "hash": "e3b0c44298fc1c149afbf4c8996fb92427ae41e4649b934ca495991b7852b855"
        },
        {
            "content_header": {
                "received": [
                    "from EXCPM5701.enterpriseapps.cuny.adlan (172.29.210.61) by EXCPM5702.enterpriseapps.cuny.adlan (172.29.210.62) with Microsoft SMTP Server (TLS) id 15.0.1497.2; Wed, 25 Aug 2021 08:33:37 -0400",
                    "from ppsm1.cuny.edu (172.28.0.167) by EXCPM5701.enterpriseapps.cuny.adlan (172.29.210.61) with Microsoft SMTP Server (TLS) id 15.0.1497.2 via Frontend Transport; Wed, 25 Aug 2021 08:33:37 -0400",
                    "from DESKTOP-9AVSAIR (host-185-25-217-220.jmdi.pl [185.25.217.220])\tby ppa1.cuny.edu (8.16.0.43/8.16.0.43) with ESMTPS id 17PCXZve013346\t(version=TLSv1.2 cipher=ECDHE-RSA-AES128-GCM-SHA256 bits=128 verify=NOT)\tfor <shkrueger@cuny.edu>; Wed, 25 Aug 2021 08:33:36 -0400"
                ],
                "authentication-results": [
                    "cuny.edu;\tspf=none smtp.mailfrom=oswald@asdfghjkl.ovh;\tdmarc=none"
                ],
                "content-type": [
                    "text/plain; charset=\"utf-8\""
                ],
                "mime-version": [
                    "1.0"
                ],
                "message-id": [
                    "<59664731-3596-4869-B4A7-C42B2EC4B31A@DESKTOP-9AVSAIR>"
                ],
                "date": [
                    "Wed, 25 Aug 2021 14:32:53 +0200"
                ],
                "from": [
                    "oswald@asdfghjkl.ovh"
                ],
                "to": [
                    "shkrueger@cuny.edu"
                ],
                "subject": [
                    "Hello, how can i help?"
                ],
                "content-transfer-encoding": [
                    "quoted-printable"
                ],
                "auto-submitted": [
                    "auto-replied"
                ],
                "x-hmailserver-loopcount": [
                    "1"
                ],
                "x-clx-response": [
                    "1TFkXBxMdEQpZRBdrfHp7Rx5mZEdOThEKWFgXZH5OZxxfcm4BZ2cRCnhOF24 dEh1BW0weTxlZEQp5TBd6ElNuRFtJS3xeBREKQ0gXBx4RCkNZFwcYHh8RCkNJFxoEGhoaEQpZTR dnZnIRCllJFwcbGXEbBgcYH3cGBx0SBhoGGgYZBhpxGhAadwYaBhoGGgYHGxoGGgYacRoQGncGG hEKWV4XaGN5EQpJRhdJX0RTdVpYRU5fSV5DRUQZXEcRCkNOF1MHSVliQXtuQHJQU1gbS2NlRRNO Z2RvH2QaHVB5ZkRZEQpYXBcfBBoEGBkZBRsaBBsbGgQfGgQbHhgQGx4aHxoRCl5ZF3N9ExoSEQp NXBccEQpMWhdSaUNraxEKRVkXTWsRCkxfF3oFBQUFBQUFBQUYEQpNThdvEQpMRhdja2trEQpCTx doZ2BLZXpDWBtSHBEKQ1oXGxIfBBgfBBgbHQQYGBoRCkJFF2R+TmccX3JuAWdnEQpCThduHRIdQ VtMHk8ZWREKQkwXZH5OZxxfcm4BZ2cRCkJsF2R+TmccX3JuAWdnEQpCQBdoWU1tSWJpaGEBbhEK QlgXaB5Af25yH35Db24RCk1eFwcbEQp5QxdpEmVSH2J+Rn8SehEKcGgXbBNlGnljEksSRRwQBxk aEQptfhcHGxEKWE0XSxEg"
                ],
                "x-proofpoint-orig-guid": [
                    "y-csHkQDjXzyr1aIOo9dMNE5N07zSLns"
                ],
                "x-clx-shades": [
                    "MLX"
                ],
                "x-proofpoint-guid": [
                    "y-csHkQDjXzyr1aIOo9dMNE5N07zSLns"
                ],
                "x-proofpoint-virus-version": [
                    "vendor=fsecure engine=2.50.10434:6.0.391,18.0.790 definitions=2021-08-25_05:2021-08-25,2021-08-25 signatures=0"
                ],
                "x-proofpoint-spam-details": [
                    "rule=inbound_notspam policy=inbound score=42 lowpriorityscore=0 clxscore=-97 priorityscore=1501 bulkscore=0 impostorscore=0 malwarescore=0 mlxscore=42 spamscore=42 mlxlogscore=15 adultscore=0 suspectscore=0 phishscore=0 classifier=spam adjust=0 reason=mlx scancount=1 engine=8.12.0-2107140000 definitions=main-2108250075"
                ],
                "return-path": [
                    "oswald@asdfghjkl.ovh"
                ]
            },
            "content": "***ATTENTION: This email came from an external source. Do not open attachments or click on links from unknown senders or unexpected emails.*** \r\n\r\nHello,\r\nhow can I help you with this?\r\n\r\nSincerely\r\nOswald\r\n\r\n",
            "content_type": "text/plain",
            "hash": "f162f665b06a01f432b7d77f7d7c4a500d3a6969178643361a50c6e21e61ed41"
        }
    ],
    "header": {
        "subject": "Undeliverable: Hello, how can i help?",
        "from": "postmaster@mail.cuny.edu",
        "to": [
            "oswald@asdfghjkl.ovh"
        ],
        "date": "2021-08-25T08:33:37-04:00",
        "received_domain": [
            "ppa3.cuny.edu",
            "excpm5702.enterpriseapps.cuny.adlan",
            "ppsm1.cuny.edu"
        ],
        "received_ip": [
            "8.16.0.43",
            "128.228.0.169"
        ],
        "received_foremail": [
            "oswald@asdfghjkl.ovh"
        ],
        "bait_method": "Other guestbooks",
        "language": "English"
    }
}