{
    "attachment": [
        {
            "filename": "part-000",
            "size": 2718,
            "hash": {
                "md5": "58542d6b9a0a995062a2255dc48c51aa",
                "sha1": "d38b903a4d0ba4e4317010a7817ded4336005e6e",
                "sha256": "f941858c58c6671be3f539491f12a3e769826f22a40b2b65c08967555c622fc1",
                "sha512": "348a830c668e2e9288ba037791ad21e610bd3712151262fbe48f3e7da71edce310a3782bfe2d45cd3734bfd6d6b9ff29ea3e7b461cb6603762f060c7a557ca8c"
            },
            "content_header": {
                "content-type": [
                    "message/rfc822"
                ]
            }
        }
    ],
    "body": [
        {
            "email": [
                "shkrueger@cuny.edu",
                "mtp.mailfrom=oswald@asdfghjkl.ovh",
                "06ae71fe-5614-4822-a94e-685955fcbf7d@desktop-9avsair",
                "oswald@asdfghjkl.ovh"
            ],
            "domain": [
                "cuny.edu",
                "excpmnj01.enterpriseapps.cuny.adlan",
                "172.20.37.161",
                "ppsm1.cuny.edu",
                "host-185-25-217-220.jmdi.pl",
                "ppa1.cuny.edu",
                "asdfghjkl.ovh"
            ],
            "ip": [
                "185.25.217.220",
                "8.16.0.43"
            ],
            "content_header": {
                "content-type": [
                    "text/plain; charset=\"us-ascii\""
                ],
                "content-transfer-encoding": [
                    "quoted-printable"
                ]
            },
            "content": "Delivery has failed to these recipients or groups:\r\n\r\nshkrueger@cuny.edu<mailto:shkrueger@cuny.edu>\r\nThe email address you entered couldn't be found. Please check the recipient's email address and try to resend the message. If the problem continues, please contact your helpdesk.\r\n\r\n\r\n\r\n\r\n\r\n\r\n\r\n\r\nDiagnostic information for administrators:\r\n\r\nGenerating server: EXCPMNJ01.enterpriseapps.cuny.adlan\r\n\r\nshkrueger@cuny.edu\r\nRemote Server returned '550 5.1.1 RESOLVER.ADR.RecipNotFound; not found'\r\n\r\nOriginal message headers:\r\n\r\nReceived: from EXCPMNJ01.enterpriseapps.cuny.adlan (172.20.37.161) by\r\n EXCPMNJ01.enterpriseapps.cuny.adlan (172.20.37.161) with Microsoft SMTP\r\n Server (TLS) id 15.0.1497.18; Sun, 29 Aug 2021 19:46:31 -0400\r\nReceived: from ppsm1.cuny.edu (172.28.0.167) by\r\n EXCPMNJ01.enterpriseapps.cuny.adlan (172.20.37.161) with Microsoft SMTP\r\n Server (TLS) id 15.0.1497.18 via Frontend Transport; Sun, 29 Aug 2021\r\n 19:46:31 -0400\r\nAuthentication-Results: cuny.edu;\r\n        spf=none smtp.mailfrom=oswald@asdfghjkl.ovh;\r\n        dmarc=none\r\nReceived: from DESKTOP-9AVSAIR (host-185-25-217-220.jmdi.pl [185.25.217.220])\r\n        by ppa1.cuny.edu (8.16.0.43/8.16.0.43) with ESMTPS id 17TNkTP9011295\r\n        (version=TLSv1.2 cipher=ECDHE-RSA-AES128-GCM-SHA256 bits=128 verify=NOT)\r\n        for <shkrueger@cuny.edu>; Sun, 29 Aug 2021 19:46:30 -0400\r\nContent-Type: text/plain; charset=\"utf-8\"\r\nMIME-Version: 1.0\r\nMessage-ID: <06AE71FE-5614-4822-A94E-685955FCBF7D@DESKTOP-9AVSAIR>\r\nDate: Mon, 30 Aug 2021 01:45:34 +0200\r\nFrom: <oswald@asdfghjkl.ovh>\r\nTo: <shkrueger@cuny.edu>\r\nSubject: Hello, how can i help?\r\nContent-Transfer-Encoding: quoted-printable\r\nAuto-Submitted: auto-replied\r\nX-hMailServer-LoopCount: 1\r\nX-Proofpoint-ORIG-GUID: 7PLPdxc0WstQS1Y7pJtpUV2BwQZAL77I\r\nX-CLX-Response: 1TFkXBxsbHBEKWUQXa3x6e0ceZmRHTk4RClhYF2R+TmccX3JuAWdnEQp4Thd\r\n uHRIdQVtMHk8ZWREKeUwXehJTbkRbSUt8XgURCkNIFwceEQpDWRcHGB4YEQpDSRcaBBoaGhEKWU\r\n 0XZ2ZyEQpZSRcHGBlxGwYHHhx3BgcSHgYaBhoGGwYacRoQGncGGgYaBhoGBxsaBhoGGnEaEBp3B\r\n hoRClleF2hjeREKSUYXSV9EU3VaWEVOX0leQ0VEGVxHEQpDThcdemZ6TlJJGn1ZXnt5G3MdWmBe\r\n Wn98GGhde3BrZh0dYxEKWFwXHwQaBBgZGQUbGgQbGxoEHxoEGx4bEBseGh8aEQpeWRdzc0luUxE\r\n KTVwXGBEKTFoXUmlDa2sRCkVZF01rEQpMXxd6BQUFBQUFBQUFGBEKTU4XbxEKTEYXY2traxEKQk\r\n 8XaGdgS2V6Q1gbUhwRCkNaFxsSHwQYHwQYGx0EGBgaEQpCRRdkfk5nHF9ybgFnZxEKQk4Xbh0SH\r\n UFbTB5PGVkRCkJMF2R+TmccX3JuAWdnEQpCbBdkfk5nHF9ybgFnZxEKQkAXaFlNbUliaWhhAW4R\r\n CkJYF2geQH9uch9+Q29uEQpNXhcHGxEKeUMXaRJlUh9ifkZ/EnoRCnBoF2wTZRp5YxJLEkUcEAc\r\n ZGhEKbX4XBxsRClhNF0sRIA==\r\nX-CLX-Shades: MLX\r\nX-Proofpoint-GUID: 7PLPdxc0WstQS1Y7pJtpUV2BwQZAL77I\r\nX-Proofpoint-Virus-Version: vendor=fsecure engine=2.50.10434:6.0.391,18.0.790\r\n definitions=2021-08-29_09:2021-08-27,2021-08-29 signatures=0\r\nX-Proofpoint-Spam-Details: rule=inbound_notspam policy=inbound score=41 mlxscore=41 clxscore=-116\r\n mlxlogscore=16 adultscore=0 spamscore=41 phishscore=0 impostorscore=0\r\n priorityscore=1501 lowpriorityscore=0 malwarescore=0 bulkscore=0\r\n suspectscore=0 classifier=spam adjust=0 reason=mlx scancount=1\r\n engine=8.12.0-2107140000 definitions=main-2108290155\r\nReturn-Path: oswald@asdfghjkl.ovh\r\n\r\n",
            "content_type": "text/plain",
            "hash": "503b2e52c9c16a23c30cfe038ef2505b2fcda3d4dc3683f886b5092af9eff8a1",
            "boundary": "e7aa5f2c-d9ae-429f-8522-7abbcd36483f"
        },
        {
            "content_header": {
                "reporting-mta": [
                    "dns;EXCPMNJ01.enterpriseapps.cuny.adlan"
                ],
                "received-from-mta": [
                    "dns;ppsm1.cuny.edu"
                ],
                "arrival-date": [
                    "Sun, 29 Aug 2021 23:46:31 +0000"
                ]
            },
            "content": "",
            "hash": "e3b0c44298fc1c149afbf4c8996fb92427ae41e4649b934ca495991b7852b855"
        },
        {
            "content_header": {
                "final-recipient": [
                    "rfc822;shkrueger@cuny.edu"
                ],
                "action": [
                    "failed"
                ],
                "status": [
                    "5.1.1"
                ],
                "diagnostic-code": [
                    "smtp;550 5.1.1 RESOLVER.ADR.RecipNotFound; not found"
                ]
            },
            "content": "",
            "hash": "e3b0c44298fc1c149afbf4c8996fb92427ae41e4649b934ca495991b7852b855"
        },
        {
            "content_header": {},
            "content": "",
            "hash": "e3b0c44298fc1c149afbf4c8996fb92427ae41e4649b934ca495991b7852b855"
        },
        {
            "content_header": {
                "received": [
                    "from EXCPMNJ01.enterpriseapps.cuny.adlan (172.20.37.161) by EXCPMNJ01.enterpriseapps.cuny.adlan (172.20.37.161) with Microsoft SMTP Server (TLS) id 15.0.1497.18; Sun, 29 Aug 2021 19:46:31 -0400",
                    "from ppsm1.cuny.edu (172.28.0.167) by EXCPMNJ01.enterpriseapps.cuny.adlan (172.20.37.161) with Microsoft SMTP Server (TLS) id 15.0.1497.18 via Frontend Transport; Sun, 29 Aug 2021 19:46:31 -0400",
                    "from DESKTOP-9AVSAIR (host-185-25-217-220.jmdi.pl [185.25.217.220])\tby ppa1.cuny.edu (8.16.0.43/8.16.0.43) with ESMTPS id 17TNkTP9011295\t(version=TLSv1.2 cipher=ECDHE-RSA-AES128-GCM-SHA256 bits=128 verify=NOT)\tfor <shkrueger@cuny.edu>; Sun, 29 Aug 2021 19:46:30 -0400"
                ],
                "authentication-results": [
                    "cuny.edu;\tspf=none smtp.mailfrom=oswald@asdfghjkl.ovh;\tdmarc=none"
                ],
                "content-type": [
                    "text/plain; charset=\"utf-8\""
                ],
                "mime-version": [
                    "1.0"
                ],
                "message-id": [
                    "<06AE71FE-5614-4822-A94E-685955FCBF7D@DESKTOP-9AVSAIR>"
                ],
                "date": [
                    "Mon, 30 Aug 2021 01:45:34 +0200"
                ],
                "from": [
                    "oswald@asdfghjkl.ovh"
                ],
                "to": [
                    "shkrueger@cuny.edu"
                ],
                "subject": [
                    "Hello, how can i help?"
                ],
                "content-transfer-encoding": [
                    "quoted-printable"
                ],
                "auto-submitted": [
                    "auto-replied"
                ],
                "x-hmailserver-loopcount": [
                    "1"
                ],
                "x-proofpoint-orig-guid": [
                    "7PLPdxc0WstQS1Y7pJtpUV2BwQZAL77I"
                ],
                "x-clx-response": [
                    "1TFkXBxsbHBEKWUQXa3x6e0ceZmRHTk4RClhYF2R+TmccX3JuAWdnEQp4Thd uHRIdQVtMHk8ZWREKeUwXehJTbkRbSUt8XgURCkNIFwceEQpDWRcHGB4YEQpDSRcaBBoaGhEKWU 0XZ2ZyEQpZSRcHGBlxGwYHHhx3BgcSHgYaBhoGGwYacRoQGncGGgYaBhoGBxsaBhoGGnEaEBp3B hoRClleF2hjeREKSUYXSV9EU3VaWEVOX0leQ0VEGVxHEQpDThcdemZ6TlJJGn1ZXnt5G3MdWmBe Wn98GGhde3BrZh0dYxEKWFwXHwQaBBgZGQUbGgQbGxoEHxoEGx4bEBseGh8aEQpeWRdzc0luUxE KTVwXGBEKTFoXUmlDa2sRCkVZF01rEQpMXxd6BQUFBQUFBQUFGBEKTU4XbxEKTEYXY2traxEKQk 8XaGdgS2V6Q1gbUhwRCkNaFxsSHwQYHwQYGx0EGBgaEQpCRRdkfk5nHF9ybgFnZxEKQk4Xbh0SH UFbTB5PGVkRCkJMF2R+TmccX3JuAWdnEQpCbBdkfk5nHF9ybgFnZxEKQkAXaFlNbUliaWhhAW4R CkJYF2geQH9uch9+Q29uEQpNXhcHGxEKeUMXaRJlUh9ifkZ/EnoRCnBoF2wTZRp5YxJLEkUcEAc ZGhEKbX4XBxsRClhNF0sRIA=="
                ],
                "x-clx-shades": [
                    "MLX"
                ],
                "x-proofpoint-guid": [
                    "7PLPdxc0WstQS1Y7pJtpUV2BwQZAL77I"
                ],
                "x-proofpoint-virus-version": [
                    "vendor=fsecure engine=2.50.10434:6.0.391,18.0.790 definitions=2021-08-29_09:2021-08-27,2021-08-29 signatures=0"
                ],
                "x-proofpoint-spam-details": [
                    "rule=inbound_notspam policy=inbound score=41 mlxscore=41 clxscore=-116 mlxlogscore=16 adultscore=0 spamscore=41 phishscore=0 impostorscore=0 priorityscore=1501 lowpriorityscore=0 malwarescore=0 bulkscore=0 suspectscore=0 classifier=spam adjust=0 reason=mlx scancount=1 engine=8.12.0-2107140000 definitions=main-2108290155"
                ],
                "return-path": [
                    "oswald@asdfghjkl.ovh"
                ]
            },
            "content": "***ATTENTION: This email came from an external source. Do not open attachments or click on links from unknown senders or unexpected emails.*** \r\n\r\nHello,\r\nhow can I help you with this?\r\n\r\nSincerely\r\nOswald\r\n\r\n",
            "content_type": "text/plain",
            "hash": "f162f665b06a01f432b7d77f7d7c4a500d3a6969178643361a50c6e21e61ed41"
        }
    ],
    "header": {
        "subject": "Undeliverable: Hello, how can i help?",
        "from": "postmaster@mail.cuny.edu",
        "to": [
            "oswald@asdfghjkl.ovh"
        ],
        "date": "2021-08-29T19:46:31-04:00",
        "received_domain": [
            "excpm5703.enterpriseapps.cuny.adlan",
            "excpmnj01.enterpriseapps.cuny.adlan",
            "ppa1.cuny.edu",
            "ppsm1.cuny.edu"
        ],
        "received_ip": [
            "8.16.0.43",
            "128.228.0.167"
        ],
        "received_foremail": [
            "oswald@asdfghjkl.ovh"
        ],
        "bait_method": "Other guestbooks",
        "language": "English"
    }
}