{
    "attachment": [
        {
            "filename": "part-000",
            "size": 2708,
            "hash": {
                "md5": "87ace2aadce62bbfbad1aa538b37d592",
                "sha1": "97b36b13aa5dfcca281a1a623113eb7738a454e5",
                "sha256": "5a04d074583cd8cd45bd6ed8df4d709575beda9473986b34e0a194c5ae34d820",
                "sha512": "911724fab079454cf512d9ead39805da2e2e8e9a1ddc800e41c228a1ef8beda2f379ef3cd78a2a517c943323a8ce2f1717d59a7a5a0e54a4dc21f9750b55011f"
            },
            "content_header": {
                "content-type": [
                    "message/rfc822"
                ]
            }
        }
    ],
    "body": [
        {
            "email": [
                "shkrueger@cuny.edu",
                "p.mailfrom=swen@asdfghjkl.ovh",
                "02ff5ffb-24ec-4820-b0de-e9f6a5653b74@desktop-9avsair",
                "swen@asdfghjkl.ovh"
            ],
            "domain": [
                "cuny.edu",
                "excpm5703.enterpriseapps.cuny.adlan",
                "excpm5704.enterpriseapps.cuny.adlan",
                "172.29.210.64",
                "172.29.210.63",
                "ppsm1.cuny.edu",
                "host-185-25-217-220.jmdi.pl",
                "ppa1.cuny.edu",
                "asdfghjkl.ovh"
            ],
            "ip": [
                "185.25.217.220",
                "8.16.0.43"
            ],
            "content_header": {
                "content-type": [
                    "text/plain; charset=\"us-ascii\""
                ],
                "content-transfer-encoding": [
                    "quoted-printable"
                ]
            },
            "content": "Delivery has failed to these recipients or groups:\r\n\r\nshkrueger@cuny.edu<mailto:shkrueger@cuny.edu>\r\nThe email address you entered couldn't be found. Please check the recipient's email address and try to resend the message. If the problem continues, please contact your helpdesk.\r\n\r\n\r\n\r\n\r\n\r\n\r\n\r\n\r\nDiagnostic information for administrators:\r\n\r\nGenerating server: EXCPM5703.enterpriseapps.cuny.adlan\r\n\r\nshkrueger@cuny.edu\r\nRemote Server returned '550 5.1.1 RESOLVER.ADR.RecipNotFound; not found'\r\n\r\nOriginal message headers:\r\n\r\nReceived: from EXCPM5704.enterpriseapps.cuny.adlan (172.29.210.64) by\r\n EXCPM5703.enterpriseapps.cuny.adlan (172.29.210.63) with Microsoft SMTP\r\n Server (TLS) id 15.0.1497.2; Wed, 25 Aug 2021 08:33:37 -0400\r\nReceived: from ppsm1.cuny.edu (172.28.0.167) by\r\n EXCPM5704.enterpriseapps.cuny.adlan (172.29.210.64) with Microsoft SMTP\r\n Server (TLS) id 15.0.1497.2 via Frontend Transport; Wed, 25 Aug 2021 08:33:37\r\n -0400\r\nAuthentication-Results: cuny.edu;\r\n        spf=none smtp.mailfrom=swen@asdfghjkl.ovh;\r\n        dmarc=none\r\nReceived: from DESKTOP-9AVSAIR (host-185-25-217-220.jmdi.pl [185.25.217.220])\r\n        by ppa1.cuny.edu (8.16.0.43/8.16.0.43) with ESMTPS id 17PCXZwb013343\r\n        (version=TLSv1.2 cipher=ECDHE-RSA-AES128-GCM-SHA256 bits=128 verify=NOT)\r\n        for <shkrueger@cuny.edu>; Wed, 25 Aug 2021 08:33:36 -0400\r\nContent-Type: text/plain; charset=\"utf-8\"\r\nMIME-Version: 1.0\r\nMessage-ID: <02FF5FFB-24EC-4820-B0DE-E9F6A5653B74@DESKTOP-9AVSAIR>\r\nDate: Wed, 25 Aug 2021 14:32:53 +0200\r\nFrom: <swen@asdfghjkl.ovh>\r\nTo: <shkrueger@cuny.edu>\r\nSubject: Hello, how can i help?\r\nContent-Transfer-Encoding: quoted-printable\r\nAuto-Submitted: auto-replied\r\nX-hMailServer-LoopCount: 1\r\nX-CLX-Response: 1TFkXBxsaHhEKWUQXa2tbY3xea2R6QUcRClhYF2xwXE1Ab1NAW11SEQp4Thd\r\n uHRIdQVtMHk8ZWREKeUwXeh9IWmZyRkFeRGkRCkNIFwceEQpDWRcHGB4fEQpDSRcaBBoaGhEKWU\r\n 0XZ2ZyEQpZSRcHGx1xGwYHGR53BgcSGQYaBhoGHAYacRoQGncGGgYaBhoGBxsaBhoGGnEaEBp3B\r\n hoRClleF2hjeREKSUYXSV9EU3VaWEVOX0leQ0VEGVxHEQpDThdIZkxbXBxzWm9EYx5gTWFEB158\r\n YVxwQ21+RkJtXXBEGhEKWFwXHwQaBBgZGQUbGgQbGxoEHxoEGx4YEBseGh8aEQpeWRdzfRMaEhE\r\n KTVwXGxgRCkxaF1JpQ2trEQpFWRdNaxEKTF8XegUFBQUFBQUFBRgRCk1OF28RCkxGF2Nra2sRCk\r\n JPF2hnYEtlekNYG1IcEQpDWhcbEh8EGB8EGBsdBBgYGhEKQkUXbHBcTUBvU0BbXVIRCkJOF24dE\r\n h1BW0weTxlZEQpCTBdscFxNQG9TQFtdUhEKQmwXbHBcTUBvU0BbXVIRCkJAF2hZTW1JYmloYQFu\r\n EQpCWBdoHkB/bnIffkNvbhEKTV4XBxsRCnlDF2kSZVIfYn5GfxJ6EQpwaBdpXxlzWlJNR1h7GxA\r\n HGRoRCm1+FwcbEQpYTRdLESA=\r\nX-Proofpoint-ORIG-GUID: bLfqv6YpEnI4JgKn-tVKvZiGTlhGwZn0\r\nX-CLX-Shades: MLX\r\nX-Proofpoint-GUID: bLfqv6YpEnI4JgKn-tVKvZiGTlhGwZn0\r\nX-Proofpoint-Virus-Version: vendor=fsecure engine=2.50.10434:6.0.391,18.0.790\r\n definitions=2021-08-25_05:2021-08-25,2021-08-25 signatures=0\r\nX-Proofpoint-Spam-Details: rule=inbound_notspam policy=inbound score=42 lowpriorityscore=0\r\n clxscore=-104 priorityscore=1501 bulkscore=0 impostorscore=0\r\n malwarescore=0 mlxscore=42 spamscore=42 mlxlogscore=15 adultscore=0\r\n suspectscore=0 phishscore=0 classifier=spam adjust=0 reason=mlx\r\n scancount=1 engine=8.12.0-2107140000 definitions=main-2108250075\r\nReturn-Path: swen@asdfghjkl.ovh\r\n\r\n",
            "content_type": "text/plain",
            "hash": "4b2f1724ebaafc37021f07223ac9908f86b6e255eba9ea03f495cd62bfed5ea9",
            "boundary": "2cbce1d8-3907-46bd-b54e-ad23d1af6a19"
        },
        {
            "content_header": {
                "reporting-mta": [
                    "dns;EXCPM5703.enterpriseapps.cuny.adlan"
                ],
                "received-from-mta": [
                    "dns;ppsm1.cuny.edu"
                ],
                "arrival-date": [
                    "Wed, 25 Aug 2021 12:33:37 +0000"
                ]
            },
            "content": "",
            "hash": "e3b0c44298fc1c149afbf4c8996fb92427ae41e4649b934ca495991b7852b855"
        },
        {
            "content_header": {
                "final-recipient": [
                    "rfc822;shkrueger@cuny.edu"
                ],
                "action": [
                    "failed"
                ],
                "status": [
                    "5.1.1"
                ],
                "diagnostic-code": [
                    "smtp;550 5.1.1 RESOLVER.ADR.RecipNotFound; not found"
                ]
            },
            "content": "",
            "hash": "e3b0c44298fc1c149afbf4c8996fb92427ae41e4649b934ca495991b7852b855"
        },
        {
            "content_header": {},
            "content": "",
            "hash": "e3b0c44298fc1c149afbf4c8996fb92427ae41e4649b934ca495991b7852b855"
        },
        {
            "content_header": {
                "received": [
                    "from EXCPM5704.enterpriseapps.cuny.adlan (172.29.210.64) by EXCPM5703.enterpriseapps.cuny.adlan (172.29.210.63) with Microsoft SMTP Server (TLS) id 15.0.1497.2; Wed, 25 Aug 2021 08:33:37 -0400",
                    "from ppsm1.cuny.edu (172.28.0.167) by EXCPM5704.enterpriseapps.cuny.adlan (172.29.210.64) with Microsoft SMTP Server (TLS) id 15.0.1497.2 via Frontend Transport; Wed, 25 Aug 2021 08:33:37 -0400",
                    "from DESKTOP-9AVSAIR (host-185-25-217-220.jmdi.pl [185.25.217.220])\tby ppa1.cuny.edu (8.16.0.43/8.16.0.43) with ESMTPS id 17PCXZwb013343\t(version=TLSv1.2 cipher=ECDHE-RSA-AES128-GCM-SHA256 bits=128 verify=NOT)\tfor <shkrueger@cuny.edu>; Wed, 25 Aug 2021 08:33:36 -0400"
                ],
                "authentication-results": [
                    "cuny.edu;\tspf=none smtp.mailfrom=swen@asdfghjkl.ovh;\tdmarc=none"
                ],
                "content-type": [
                    "text/plain; charset=\"utf-8\""
                ],
                "mime-version": [
                    "1.0"
                ],
                "message-id": [
                    "<02FF5FFB-24EC-4820-B0DE-E9F6A5653B74@DESKTOP-9AVSAIR>"
                ],
                "date": [
                    "Wed, 25 Aug 2021 14:32:53 +0200"
                ],
                "from": [
                    "swen@asdfghjkl.ovh"
                ],
                "to": [
                    "shkrueger@cuny.edu"
                ],
                "subject": [
                    "Hello, how can i help?"
                ],
                "content-transfer-encoding": [
                    "quoted-printable"
                ],
                "auto-submitted": [
                    "auto-replied"
                ],
                "x-hmailserver-loopcount": [
                    "1"
                ],
                "x-clx-response": [
                    "1TFkXBxsaHhEKWUQXa2tbY3xea2R6QUcRClhYF2xwXE1Ab1NAW11SEQp4Thd uHRIdQVtMHk8ZWREKeUwXeh9IWmZyRkFeRGkRCkNIFwceEQpDWRcHGB4fEQpDSRcaBBoaGhEKWU 0XZ2ZyEQpZSRcHGx1xGwYHGR53BgcSGQYaBhoGHAYacRoQGncGGgYaBhoGBxsaBhoGGnEaEBp3B hoRClleF2hjeREKSUYXSV9EU3VaWEVOX0leQ0VEGVxHEQpDThdIZkxbXBxzWm9EYx5gTWFEB158 YVxwQ21+RkJtXXBEGhEKWFwXHwQaBBgZGQUbGgQbGxoEHxoEGx4YEBseGh8aEQpeWRdzfRMaEhE KTVwXGxgRCkxaF1JpQ2trEQpFWRdNaxEKTF8XegUFBQUFBQUFBRgRCk1OF28RCkxGF2Nra2sRCk JPF2hnYEtlekNYG1IcEQpDWhcbEh8EGB8EGBsdBBgYGhEKQkUXbHBcTUBvU0BbXVIRCkJOF24dE h1BW0weTxlZEQpCTBdscFxNQG9TQFtdUhEKQmwXbHBcTUBvU0BbXVIRCkJAF2hZTW1JYmloYQFu EQpCWBdoHkB/bnIffkNvbhEKTV4XBxsRCnlDF2kSZVIfYn5GfxJ6EQpwaBdpXxlzWlJNR1h7GxA HGRoRCm1+FwcbEQpYTRdLESA="
                ],
                "x-proofpoint-orig-guid": [
                    "bLfqv6YpEnI4JgKn-tVKvZiGTlhGwZn0"
                ],
                "x-clx-shades": [
                    "MLX"
                ],
                "x-proofpoint-guid": [
                    "bLfqv6YpEnI4JgKn-tVKvZiGTlhGwZn0"
                ],
                "x-proofpoint-virus-version": [
                    "vendor=fsecure engine=2.50.10434:6.0.391,18.0.790 definitions=2021-08-25_05:2021-08-25,2021-08-25 signatures=0"
                ],
                "x-proofpoint-spam-details": [
                    "rule=inbound_notspam policy=inbound score=42 lowpriorityscore=0 clxscore=-104 priorityscore=1501 bulkscore=0 impostorscore=0 malwarescore=0 mlxscore=42 spamscore=42 mlxlogscore=15 adultscore=0 suspectscore=0 phishscore=0 classifier=spam adjust=0 reason=mlx scancount=1 engine=8.12.0-2107140000 definitions=main-2108250075"
                ],
                "return-path": [
                    "swen@asdfghjkl.ovh"
                ]
            },
            "content": "***ATTENTION: This email came from an external source. Do not open attachments or click on links from unknown senders or unexpected emails.*** \r\n\r\nHello,\r\nhow can I help you with this?\r\n\r\nSincerely\r\nSwen\r\n\r\n",
            "content_type": "text/plain",
            "hash": "cfd51d160082b2c3cb90606e9d493be5eac219a9a3fbd66f59e9f26153754108"
        }
    ],
    "header": {
        "subject": "Undeliverable: Hello, how can i help?",
        "from": "postmaster@mail.cuny.edu",
        "to": [
            "swen@asdfghjkl.ovh"
        ],
        "date": "2021-08-25T08:33:37-04:00",
        "received_domain": [
            "excpm5703.enterpriseapps.cuny.adlan",
            "ppa2.cuny.edu",
            "ppsm1.cuny.edu"
        ],
        "received_ip": [
            "8.16.0.43",
            "128.228.0.168"
        ],
        "received_foremail": [
            "swen@asdfghjkl.ovh"
        ],
        "bait_method": "Other guestbooks",
        "language": "English"
    }
}