{
    "attachment": [
        {
            "filename": "part-000",
            "size": 2719,
            "hash": {
                "md5": "370b640799f2f3433e17da3c7d5d6fd1",
                "sha1": "a279019f622913fb0e3a2a7866ced17990aba617",
                "sha256": "144382745b3df4aa4744fe67f32abcc89ed6163e86ea291baa4129b2c1e9e54f",
                "sha512": "482a623611ee26443769f0b5ac722306f5712169a42cc314255036958d184d208dbd92ba615e02eff2177f440786c23aa77a18441581db0e949cf67db2310144"
            },
            "content_header": {
                "content-type": [
                    "message/rfc822"
                ]
            }
        }
    ],
    "body": [
        {
            "email": [
                "shkrueger@cuny.edu",
                "mtp.mailfrom=gertrude@asdfghjkl.ovh",
                "47b3c7ed-6d24-4690-9e67-d25eb494397b@desktop-9avsair",
                "gertrude@asdfghjkl.ovh"
            ],
            "domain": [
                "cuny.edu",
                "excpmnj04.enterpriseapps.cuny.adlan",
                "excpmnj02.enterpriseapps.cuny.adlan",
                "172.20.37.162",
                "172.20.37.164",
                "ppsm1.cuny.edu",
                "host-185-25-217-220.jmdi.pl",
                "ppa1.cuny.edu",
                "asdfghjkl.ovh"
            ],
            "ip": [
                "185.25.217.220",
                "8.16.0.43"
            ],
            "content_header": {
                "content-type": [
                    "text/plain; charset=\"us-ascii\""
                ],
                "content-transfer-encoding": [
                    "quoted-printable"
                ]
            },
            "content": "Delivery has failed to these recipients or groups:\r\n\r\nshkrueger@cuny.edu<mailto:shkrueger@cuny.edu>\r\nThe email address you entered couldn't be found. Please check the recipient's email address and try to resend the message. If the problem continues, please contact your helpdesk.\r\n\r\n\r\n\r\n\r\n\r\n\r\n\r\n\r\nDiagnostic information for administrators:\r\n\r\nGenerating server: EXCPMNJ04.enterpriseapps.cuny.adlan\r\n\r\nshkrueger@cuny.edu\r\nRemote Server returned '550 5.1.1 RESOLVER.ADR.RecipNotFound; not found'\r\n\r\nOriginal message headers:\r\n\r\nReceived: from EXCPMNJ02.enterpriseapps.cuny.adlan (172.20.37.162) by\r\n EXCPMNJ04.enterpriseapps.cuny.adlan (172.20.37.164) with Microsoft SMTP\r\n Server (TLS) id 15.0.1497.18; Sun, 29 Aug 2021 19:46:31 -0400\r\nReceived: from ppsm1.cuny.edu (172.28.0.167) by\r\n EXCPMNJ02.enterpriseapps.cuny.adlan (172.20.37.162) with Microsoft SMTP\r\n Server (TLS) id 15.0.1497.18 via Frontend Transport; Sun, 29 Aug 2021\r\n 19:46:31 -0400\r\nAuthentication-Results: cuny.edu;\r\n        spf=none smtp.mailfrom=gertrude@asdfghjkl.ovh;\r\n        dmarc=none\r\nReceived: from DESKTOP-9AVSAIR (host-185-25-217-220.jmdi.pl [185.25.217.220])\r\n        by ppa1.cuny.edu (8.16.0.43/8.16.0.43) with ESMTPS id 17TNkTuc011294\r\n        (version=TLSv1.2 cipher=ECDHE-RSA-AES128-GCM-SHA256 bits=128 verify=NOT)\r\n        for <shkrueger@cuny.edu>; Sun, 29 Aug 2021 19:46:30 -0400\r\nContent-Type: text/plain; charset=\"utf-8\"\r\nMIME-Version: 1.0\r\nMessage-ID: <47B3C7ED-6D24-4690-9E67-D25EB494397B@DESKTOP-9AVSAIR>\r\nDate: Mon, 30 Aug 2021 01:45:34 +0200\r\nFrom: <gertrude@asdfghjkl.ovh>\r\nTo: <shkrueger@cuny.edu>\r\nSubject: How can i help?\r\nContent-Transfer-Encoding: quoted-printable\r\nAuto-Submitted: auto-replied\r\nX-hMailServer-LoopCount: 1\r\nX-Proofpoint-ORIG-GUID: 4OnjR6aEqHYuBV0GiPbh2lz5kTS9Mr7K\r\nX-CLX-Response: 1TFkXBxseHBEKWUQXZktsRFgcb1NFX1IRClhYF2MaHnJJensScHwcEQp4Thd\r\n uHRIdQVtMHk8ZWREKeUwXa2kBaUJLfVJSWGARCkNIFwceEQpDWRcHHRoRCkNJFxoEGhoaEQpZTR\r\n dnZnIRCllJFwcYGnEbBgcZE3cGBxIdBhoGGgYaBgcZGnEaEBt3BhoGGgYaBgcbGgYaBhpxGhAad\r\n wYaEQpZXhdoY3kRCklGF0lfRFN1WlhFTl9JXkNFRBlcRxEKQ04XHmVEQHgcS29bYnNfaHwabUN6\r\n SEIYRlAfQX55E2dYHWERClhcFx8EGgQYGRkFGxoEGxsaBB8aBBseGBAbHhofGhEKXlkXc3NJblM\r\n RCk1cFxsRCkxaF11uQ3trEQpFWRdNaxEKTF8XegUFBQUFBQUFBRgRCk1OF28RCkxGF2Nra2sRCk\r\n JPF2hnYEtlekNYG1IcEQpDWhcbEh8EGB8EGBsdBBgYGhEKQkUXYxoeckl6exJwfBwRCkJOF24dE\r\n h1BW0weTxlZEQpCTBdjGh5ySXp7EnB8HBEKQmwXYxoeckl6exJwfBwRCkJAF21HXmgBGgEScHgf\r\n EQpCWBdoHkB/bnIffkNvbhEKTV4XBxsRCnlDF2kZWlpgSXNrQmsbEQpwaBdgcH4ZWx5YWVx6ZBA\r\n HGRoRCm1+FwcbEQpYTRdLESA=\r\nX-CLX-Shades: MLX\r\nX-Proofpoint-GUID: 4OnjR6aEqHYuBV0GiPbh2lz5kTS9Mr7K\r\nX-Proofpoint-Virus-Version: vendor=fsecure engine=2.50.10434:6.0.391,18.0.790\r\n definitions=2021-08-29_09:2021-08-27,2021-08-29 signatures=0\r\nX-Proofpoint-Spam-Details: rule=inbound_notspam policy=inbound score=21 mlxscore=21 clxscore=-146\r\n mlxlogscore=57 adultscore=0 spamscore=21 phishscore=0 impostorscore=0\r\n priorityscore=1501 lowpriorityscore=0 malwarescore=0 bulkscore=0\r\n suspectscore=0 classifier=spam adjust=0 reason=mlx scancount=1\r\n engine=8.12.0-2107140000 definitions=main-2108290155\r\nReturn-Path: gertrude@asdfghjkl.ovh\r\n\r\n",
            "content_type": "text/plain",
            "hash": "f82458f85f410e7ee80d1f715f5c7f725ea9cf5a150aed593d8602cd495b7f2f",
            "boundary": "ca64f74d-75c0-4202-bee7-391dd9d1fd1c"
        },
        {
            "content_header": {
                "reporting-mta": [
                    "dns;EXCPMNJ04.enterpriseapps.cuny.adlan"
                ],
                "received-from-mta": [
                    "dns;ppsm1.cuny.edu"
                ],
                "arrival-date": [
                    "Sun, 29 Aug 2021 23:46:31 +0000"
                ]
            },
            "content": "",
            "hash": "e3b0c44298fc1c149afbf4c8996fb92427ae41e4649b934ca495991b7852b855"
        },
        {
            "content_header": {
                "final-recipient": [
                    "rfc822;shkrueger@cuny.edu"
                ],
                "action": [
                    "failed"
                ],
                "status": [
                    "5.1.1"
                ],
                "diagnostic-code": [
                    "smtp;550 5.1.1 RESOLVER.ADR.RecipNotFound; not found"
                ]
            },
            "content": "",
            "hash": "e3b0c44298fc1c149afbf4c8996fb92427ae41e4649b934ca495991b7852b855"
        },
        {
            "content_header": {},
            "content": "",
            "hash": "e3b0c44298fc1c149afbf4c8996fb92427ae41e4649b934ca495991b7852b855"
        },
        {
            "content_header": {
                "received": [
                    "from EXCPMNJ02.enterpriseapps.cuny.adlan (172.20.37.162) by EXCPMNJ04.enterpriseapps.cuny.adlan (172.20.37.164) with Microsoft SMTP Server (TLS) id 15.0.1497.18; Sun, 29 Aug 2021 19:46:31 -0400",
                    "from ppsm1.cuny.edu (172.28.0.167) by EXCPMNJ02.enterpriseapps.cuny.adlan (172.20.37.162) with Microsoft SMTP Server (TLS) id 15.0.1497.18 via Frontend Transport; Sun, 29 Aug 2021 19:46:31 -0400",
                    "from DESKTOP-9AVSAIR (host-185-25-217-220.jmdi.pl [185.25.217.220])\tby ppa1.cuny.edu (8.16.0.43/8.16.0.43) with ESMTPS id 17TNkTuc011294\t(version=TLSv1.2 cipher=ECDHE-RSA-AES128-GCM-SHA256 bits=128 verify=NOT)\tfor <shkrueger@cuny.edu>; Sun, 29 Aug 2021 19:46:30 -0400"
                ],
                "authentication-results": [
                    "cuny.edu;\tspf=none smtp.mailfrom=gertrude@asdfghjkl.ovh;\tdmarc=none"
                ],
                "content-type": [
                    "text/plain; charset=\"utf-8\""
                ],
                "mime-version": [
                    "1.0"
                ],
                "message-id": [
                    "<47B3C7ED-6D24-4690-9E67-D25EB494397B@DESKTOP-9AVSAIR>"
                ],
                "date": [
                    "Mon, 30 Aug 2021 01:45:34 +0200"
                ],
                "from": [
                    "gertrude@asdfghjkl.ovh"
                ],
                "to": [
                    "shkrueger@cuny.edu"
                ],
                "subject": [
                    "How can i help?"
                ],
                "content-transfer-encoding": [
                    "quoted-printable"
                ],
                "auto-submitted": [
                    "auto-replied"
                ],
                "x-hmailserver-loopcount": [
                    "1"
                ],
                "x-proofpoint-orig-guid": [
                    "4OnjR6aEqHYuBV0GiPbh2lz5kTS9Mr7K"
                ],
                "x-clx-response": [
                    "1TFkXBxseHBEKWUQXZktsRFgcb1NFX1IRClhYF2MaHnJJensScHwcEQp4Thd uHRIdQVtMHk8ZWREKeUwXa2kBaUJLfVJSWGARCkNIFwceEQpDWRcHHRoRCkNJFxoEGhoaEQpZTR dnZnIRCllJFwcYGnEbBgcZE3cGBxIdBhoGGgYaBgcZGnEaEBt3BhoGGgYaBgcbGgYaBhpxGhAad wYaEQpZXhdoY3kRCklGF0lfRFN1WlhFTl9JXkNFRBlcRxEKQ04XHmVEQHgcS29bYnNfaHwabUN6 SEIYRlAfQX55E2dYHWERClhcFx8EGgQYGRkFGxoEGxsaBB8aBBseGBAbHhofGhEKXlkXc3NJblM RCk1cFxsRCkxaF11uQ3trEQpFWRdNaxEKTF8XegUFBQUFBQUFBRgRCk1OF28RCkxGF2Nra2sRCk JPF2hnYEtlekNYG1IcEQpDWhcbEh8EGB8EGBsdBBgYGhEKQkUXYxoeckl6exJwfBwRCkJOF24dE h1BW0weTxlZEQpCTBdjGh5ySXp7EnB8HBEKQmwXYxoeckl6exJwfBwRCkJAF21HXmgBGgEScHgf EQpCWBdoHkB/bnIffkNvbhEKTV4XBxsRCnlDF2kZWlpgSXNrQmsbEQpwaBdgcH4ZWx5YWVx6ZBA HGRoRCm1+FwcbEQpYTRdLESA="
                ],
                "x-clx-shades": [
                    "MLX"
                ],
                "x-proofpoint-guid": [
                    "4OnjR6aEqHYuBV0GiPbh2lz5kTS9Mr7K"
                ],
                "x-proofpoint-virus-version": [
                    "vendor=fsecure engine=2.50.10434:6.0.391,18.0.790 definitions=2021-08-29_09:2021-08-27,2021-08-29 signatures=0"
                ],
                "x-proofpoint-spam-details": [
                    "rule=inbound_notspam policy=inbound score=21 mlxscore=21 clxscore=-146 mlxlogscore=57 adultscore=0 spamscore=21 phishscore=0 impostorscore=0 priorityscore=1501 lowpriorityscore=0 malwarescore=0 bulkscore=0 suspectscore=0 classifier=spam adjust=0 reason=mlx scancount=1 engine=8.12.0-2107140000 definitions=main-2108290155"
                ],
                "return-path": [
                    "gertrude@asdfghjkl.ovh"
                ]
            },
            "content": "***ATTENTION: This email came from an external source. Do not open attachments or click on links from unknown senders or unexpected emails.*** \r\n\r\nHello,\r\nhow can I help you with this?\r\n\r\nSincerely\r\nGertrude\r\n\r\n",
            "content_type": "text/plain",
            "hash": "d8732a797930d79ca2f8eefef198572c4f8e2f3df7b206e69f3ebdcd51685e67"
        }
    ],
    "header": {
        "subject": "Undeliverable: How can i help?",
        "from": "postmaster@mail.cuny.edu",
        "to": [
            "gertrude@asdfghjkl.ovh"
        ],
        "date": "2021-08-29T19:46:31-04:00",
        "received_domain": [
            "ppa2.cuny.edu",
            "excpm5702.enterpriseapps.cuny.adlan",
            "excpmnj04.enterpriseapps.cuny.adlan",
            "ppsm1.cuny.edu"
        ],
        "received_ip": [
            "8.16.0.43",
            "128.228.0.168"
        ],
        "received_foremail": [
            "gertrude@asdfghjkl.ovh"
        ],
        "bait_method": "Other guestbooks",
        "language": "English"
    }
}